{"$schema":"https://json-schema.org/draft/2020-12/schema","$id":"https://recrafts.local/contracts/envelope-response.schema.json","type":"object","additionalProperties":false,"required":["protocol_version","request_id","operation","status","host_handshake","artifacts","validation","warnings","error"],"properties":{"protocol_version":{"enum":["1.0","1.1","1.2"]},"request_id":{"type":"string"},"operation":{"type":"string"},"status":{"enum":["completed","completed_with_warnings","needs_host_action","failed"]},"host_handshake":{"type":"object"},"host_action":{"type":["object","null"]},"artifacts":{"type":"array"},"validation":{"type":"object"},"warnings":{"type":"array","items":{"type":"string"}},"error":{"type":["object","null"]}}}
