{"protocol_version":"1.1","request_id":"build2-stale-accept","operation":"accept-artifacts","status":"failed","host_handshake":{"required_capabilities":["files","structured-output"],"provided_capabilities":["files","structured-output"],"missing_required":[],"host_agent":"qualification-shell","host_engine":"node"},"host_action":null,"artifacts":[],"validation":{},"warnings":[],"error":{"code":"REALIZATION_NOT_AUTHORIZED","message":"Partial, stale or blocked mandatory source cannot be accepted"}}
